id,kategory,judul,isi92,finance,Menteri ATR Akui Masih Ada Pungli di Program Sertifikat Tanah,"['Jakarta - Ada nada sumbang di balik gencarnya pemerintah bagi-bagi sertifikat hak atas tanah. Nada sumbang itu adalah keluhan masyarakat yang mengalami pungutan liar saat mengurus sertifikat tanah lewat program PTSL (Pendaftaran Tanah Sistematis Lengkap), padahal dijanjikan gratis. Menteri Agraria dan Tata Ruang (ATR)/Kepala Badan Pertanahan Nasional (BPN) Sofyan Djalil pun mengakui masih ada praktik pungli pada pengurusan sertifikat tanah lewat program PTSL.""Jadi itu sangat sedikit dibandingkan dengan jutaan (sertifikat) yang kita keluarkan, relatif sekarang ini pungli masih ada saya akui, tapi relatif sedikit. Tapi ini tidak boleh dibiarkan,"" kata Sofyan di Gelanggang Remaja, Pasar Minggu, Jakarta Selatan, Jumat (22/2/2019). googletag.cmd.push(function() { googletag.display(\'div-gpt-ad-1535944306169-0\'); }); Baca juga: Heboh Warga Tebus Sertifikat Tanah Rp 2,5 Juta, Seharusnya GratisSofyan menjelaskan pada program sertifikat tanah memang ada biaya yang harus dikeluarkan masyarakat. Hal itu juga sesuai dengan keputusan bersama Menteri ATR, Menteri Dalam Negerti, dan Menteri Desa, Pembangunan Daerah Tertinggal dan Transmigrasi.Dalam keputusan tersebut diatur tentang biaya dalam rangka pelaksanaan persiapan pendaftaran tanah sistematis, seperti kegiatan penyiapan dokumen, kegiatan pengadaan patok dan materai, lalu kegiatan operasional petugas kelurahan/desa.Dalam kesekapatan itu juga telah ditetapkan biaya yang harus dibayarkan oleh masyarakat. Kategori I untuk Provinsi Papua, Maluku Utara, dan Nusa Tenggara Timur (NTT) sebesar Rp 450.000.Baca juga: Warga Dimintai Uang Urus Sertifikat Tanah, KSP: Itu Pelanggaran!Ketegori II untuk Provinsi Kepulauan Riau, Bangka Belitung, Sulawesi Tengah, Sulawesi Utara, Sulawesi Tenggara, Nusa Tenggara Barat (NTB) sebesar Rp 350.000.Kategori III untuk Provinsi Gorontalo, Sulawesi Barat, Sulawesi Selatan, Kalimantan Tengah, Kalimantan Barat, Sumatera Utara, Aceh, Sumatera Barat, Kalimantan Timur sebesar Rp 250.000.Kategori IV untuk Provinsi Riau, Jambi, Sumatera Selatan, Lampung, Bengkulu, Kalimantan Selatan sebesar Rp 200.000.Kategori V untuk Pulau Jawa dan Bali sebesar Rp 150.000.Baca juga: Sertifikat Tanah Disebut Tak Ada Gunanya, Jokowi: Kita Lanjutkan!Sofyan mengklaim praktik pungli terjadi di tingkat desa, Sedangkan di BPN sendiri sudah tidak ada. Dia pun meminta kepada masyarakat untuk melaporkan ke aparat penegak hukum seperti Polisi, jika dimintai dana lebih dari keputusan tiga menteri.""Ya kalau pungli itu dilakukan di luar BPN yah, biasanya itu adalah di tingkat desa, jadi sudah ada ketentuan maksimum yang boleh diambil, kalau ambil lebih dari itu di luar persetujuan masyarakat itu sebetulnya tinggal melaporkan ke aparat penegak hukum saja, dan beberapa sudah diambil tindakan oleh polisi,"" kata mantan Menteri Koordinator Perekonomian itu.Sebelumnya, muncul kabar mengenai warga Pondok Cabe Ilir, Tangerang Selatan, Banten yang mengaku membayar sejumlah uang untuk mengurus PTSL. Jumlah yang dibayarkan bahkan mencapai Rp 2,5 juta. Padahal, seharusnya program sertifikasi tanah ini cuma-cuma dan tanpa biaya.Simak Juga \'Jokowi Bagikan 40.172 Sertifikat Tanah di Tangsel\':[Gambas:Video 20detik] (hek/hns) sertifikat tanah tanah bpn badan pertanahan nasional menteri atr sofyan djalil <!--// <![CDATA[ OA_show(\'newstag\'); // ]]> --> <!--// <![CDATA[ OA_show(\'hiddenquiz\'); // ]]> -->']"
93,finance,Arisan Investasi atau Bukan? (Bagian 1),"['Jakarta - Bagi setiap orang khususnya kaum hawa arisan adalah sebuah keharusan, alasannya dengan mengikuti arisan bisa menjaga tali silaturahmi dengan teman atau sahabat atau bisa menambah pertemanan baru.Arisan merupakan aktifitas yang wajar di Indonesia bahkan sebuah keharusan bahkan ada yang bilang bahwa arisan sama dengan menabung. Hmm..apakah benar seperti itu?Arisan selalu menjadi bumbu dalam pergaulan, sejak bertahun-tahun lalu arisan sudah sangat popular sebagai ajang kumpul-kumpul yang melibatkan setoran uang dari seluruh peserta dengan jumlah yang telah disepakati. googletag.cmd.push(function() { googletag.display(\'div-gpt-ad-1535944306169-0\'); }); Dan pemenangnya akan diundi secara bergantian untuk mendapatkan uang atau barang yang telah disepakati.Ketika saya bertanya ke beberapa teman rata-rata semua menjawab dalam setiap bulan pasti ada anggaran untuk arisan, bahkan dalam sebulan bisa mengikuti lebih dari 1 arisan. Dan rata-rata juga alasan mengikuti arisan adalah sama yaitu sebagai ajang mempererat tali silaturahmi dan cara yang mudah untuk menabung. Jangka waktu arisan juga bisa disesuaikan dengan kesepakatan bersama, ada yang per bulan, per dua minggu sekali atau seminggu sekali. Jenis arisan pun bermacam-macam dari yang hanya berupa uang, barang, emas sampai hal yang tidak masuk akal sekalipun.Memang arisan masa kini tidak hanya mendapatkan uang, akan tetapi bisa juga arisan emas, berlian, atau tas bermerk. Hal tersebut dianggap sebagian orang mengikuti arisan mendapatkan keuntungan karena mendapat barang tersebut.Dalam manajemen keuangan keluarga, pengeluaran untuk arisan perlu diatur. Jumlah setoran perlu dimasukkan dalam daftar pengeluaran rutin dan bisa dimasukkan dalam alokasi dana lifestyle. Priorotas utama tentunya kebutuhan bulanan rutin misalnya SPP anak, membayar PDAM, membayar listrik dan kebutuhan bulanan lainnya.Apakah Arisan termasuk menabung?Seperti yang saya sebutkan di atas bahwa rata-rata orang menganggap bahwa arisan adalah menabung. Tapi mari kita berpikir sejenak, jika memang arisan adalah menabung, apakah arisan ada bunganya?Tentu saja tidak. Memang sih tidak ada biaya administrasi tapi ada biaya konsumsi yang terkadang tidak dihitung oleh peserta arisan. Padahal jika tujuan kita adalah menabung, kenapa uangnya tidakdialokasikan ke bank atau portfolio investasi lainnya.Arisan hanya sebagai ajang sosialisasi Arisan memang dijadikan ajang sosialisasi berbalut silaturahmi bagi beberapa orang, padahal jika kita ingin menjalin silaturahmi dengan teman,sahabat atau bahkan saudara bisa dilakukan walaupun tanpa arisan. Kita bisa bertemu dengan teman, ngobrol banyak hal tanpa harus menyetorkan uang.Arisan bisa membuat lebih borosUmumnya ketika mendapat arisan, anda otomatis mendapatkan ""ketempatan"" yang berarti anda harus memberikan jamuan. Ini bukan hanya merepotkan akan tetapi juga membuat anda untuk mengeluarkan uang lebih banyak dari yang anda dapatkan.Arisan tidak LiquidBagaimana jika kita membutuhkan uang cepat? Apakah uang arisan bisa kita cairkan dengan mudah dan cepat? Anda harus menunggu nama anda keluar dari kocokan. Atau kalau memang kita sangatmembutuhkan uang tersebut kita bisa saja merayu sang bendahara arisan, itu pun belum tentu juga rayuan anda dikabulkan. Lalu apa yang bisa kita lakukan? Sementara jika kita menabung di bank maka kita bisa mengambil uang kita kapanpun dan sangat liquid. Selain tidak liquid uang arisan nilainya juga akan tergerus inflasi. Nilai uang yang diterima anggota pertama kali berbeda dengan nilai yang diterim oleh anggota yang mendapatkan kocokan terakhir. Misal kita ikuta arisan dengan jumlah uang yang kita terima Rp 2000.000,- tapi kita tidak tahu kapan akan menang kocokan. Jika kita menang terakhir 10 bulan kemudian maka hasilnya tidak akan sama dengan 10 bulan sebelumnya. Ternyata banyak ya kelemahan arisan yang selama ini mungkin tidak/belum dilihat oleh orang banyak.Hal seperti ini yang dibahas di workshop Perencanaan Keuangan dan Investasi yang dilaksanakan oleh tim IARFC Indonesia, Associates. Di Jakarta dibuka workshop sehari tentang bagaimana cara Mengelola Gaji dan Mengatur Uang bulanan dan Belajar dan Teknik Menjadi Kaya Raya dan juga workshop sehari tentang Reksadana info . (dna/dna) perencana keuangan arisan <!--// <![CDATA[ OA_show(\'newstag\'); // ]]> --> <!--// <![CDATA[ OA_show(\'hiddenquiz\'); // ]]> -->']"
94,finance,,['']
95,finance,Freeport Jual Alat Tambangnya di Papua ke Benua Amerika,"['Jakarta - PT Freeport Indonesia sejak 2018 mulai mengirim peralatan tambang ke sejumlah perusahaan pertambangan di luar negeri, khususnya di wilayah Amerika Selatan dan Amerika Utara. Hal ini dilakukan karena akan berakhirnya masa penambangan Grasberg Open Pit Tembagapura, Mimika, Papua.Juru Bicara PT Freeport Indonesia Riza Pratama mengatakan dengan akan berakhirnya operasi penambangan Grasberg Open Pit maka sejumlah peralatan tambang terbuka seperti truk tambang berkapasitas besar (haul truck) itu keberadaannya sudah tidak efektif, sebab Freeport kini berkonsentrasi pada pengembangan operasi tambang bawah tanah (underground mining).""Saya dengar memang ada pengiriman \'haul truck\' itu. Grasberg ini memang sebentar lagi akan selesai masanya. Sekarang memang masih berproduksi tapi sudah tahap final atau hampir selesai,"" kata Riza dikutip dari Antara di Timika, Papua.Manajer Ekspor Impor PT Freeport Indonesia Edwin Kailola mengatakan pada Desember 2018 pihaknya mengirim sebanyak 60 unit truk tambang Komatsu tipe 930 ke tambang di Peru, Amerika Selatan.Tahun ini Freeport berencana mengirim beberapa truk tambang lainnya ke sejumlah perusahaan pertambangan di wilayah Amerika Utara.""Kami akan sibuk dengan pengiriman beberapa peralatan tambang ke luar negeri,"" kata Edwin saat pertemuan dengan Kepala Kantor Wilayah Direktorat Jenderal Bea Cukai Khusus Papua Akhmad Rofiq di Timika, pekan lalu. (dna/dna) freeport freeport indonesia <!--// <![CDATA[ OA_show(\'newstag\'); // ]]> --> <!--// <![CDATA[ OA_show(\'hiddenquiz\'); // ]]> --> Sebelumnya Sudirman Said Menyerang, Jokowi Menjawab 1 / 3 Selanjutnya Tambang Grasberg Sudah Habis']"
96,finance,"Aturan THR untuk PNS 2019 Dikebut, Terbit Sebelum Pilpres","['Jakarta - Pemerintah mempercepat penyusunan Peraturan Pemerintah (RPP) tentang pemberian THR 2019 dan Gaji ke-13 untuk PNS atau ASN. PP Pemberian THR untuk PNS dikebut agar terbit sebelum pilpres April nanti. Hal tersebut tertuang dalam surat yang diterbitkan oleh Kementerian Keuangan (Kemenkeu) yang beredar dan dikutip detikFinance, Jumat (22/2/2019). Surat tersebut ditujukan untuk Deputi Bidang Sumber Daya Manusia dan Aparatur Kementerian Pendayagunaan Aparatur Negara dan Reformasi Birokrasi (PAN-RB). ""Mengingat jadwal pemilihan presiden pada tanggal 17 April 2019, diharapkan PP Pemberian THR Tahun 2019 dan Gaji ke-13 dapat ditetapkan sebelum pemilihan presiden,"" bunyi surat keterangan Kemenkeu. googletag.cmd.push(function() { googletag.display(\'div-gpt-ad-1535944306169-0\'); }); Baca juga: Iri dengan DPRD, Ini Besaran Gaji GubernurSurat tersebut ditandatangani oleh Direktur Pelaksanaan Anggaran Ditjen Perbendaharaan Kemenkeu Wiwin Istanti, tertanggal 22 Januari 2019.Sementara dalam surat tersebut juga, waktu pembayaran THR PNS 2019 efektir dibayar pada bulan Mei 2019, 1 bulan setelah pilpres. Dalam surat tersebut juga dituliskan bahwa PP Pemberian THR diinisiasi oleh Kementerian Pendayagunaan Aparatur Negara dan Reformasi Birokrasi (PAN-RB).Baca juga: PNS \'Ketiban Durian Runtuh\'""PP Pemberian THR Tahun 2019 dan Gaji ke-13 yang diinisiasi oleh Kementerian PANRB manjadi dasar dalam penyusunan PMK THR Tahun 2019 dan Gaji ke-13,"" jelas isi surat tersebut.Dalam informasi tersebut diterangkan bahwa pada 2018, gaji ke-13 dibayarkan pada bulan Juli 2018 dan THR dibayarkan pada bulan Juni 2018.Kepala Biro Hukum, Komunikasi dan Informasi Publik Kementerian PAN-RB Mudzakir mengatakan, percepatan penyusunan PP THR merupakan siklus yang wajar.Baca juga: Besarnya THR Tahun Ini yang Bikin PNS Tersenyum""Surat itu benar. Secara siklus penyusunan RPP THR dan gaji ke-13 memang dilakukan di bulan Maret dan April sehingga apa yang tercantum dalam surat sesuatu yang normal saja,"" jelasnya kepada detikFinance.Tonton juga video saat H-7 Lebaran Masih Ada Perusahaan Belum Bayar THR:[Gambas:Video 20detik] (zlf/zlf) thr pns thr untuk pns gaji pns thr <!--// <![CDATA[ OA_show(\'newstag\'); // ]]> --> <!--// <![CDATA[ OA_show(\'hiddenquiz\'); // ]]> -->']"
97,finance,"T-Cash Resmi Jadi LinkAja, Siap Saingi Go-Pay dan OVO","['Jakarta - Layanan keuangan elektronik milik Telkomsel yakni TCASH resmi berubah menjadi LinkAja terhitung 22 Februari 2019. Mengutip siaran pers, dengan perubahan ini aplikasi TCASH akan otomatis terkonversi menjadi LinkAja, sedangkan pelanggan yang masih menggunakan USSD perlu memberikan persetujuan melalui menu akses *800#.""Sejak tanggal 22 Februari 2018, layanan uang elektronik TCASH efektif berubah menjadi LinkAja. Pelanggan TCASH tidak perlu khawatir, karena semua layanan dan fitur yang sebelumnya tersedia pada layanan TCASH tetap dapat diakses dan dinikmati pada layanan LinkAja. Terlebih lagi, kami akan mengembangkan berbagai fitur baru untuk LinkAja dari waktu ke waktu,"" ujar Direktur Finarya, Danu Wicaksana dalam siaran pers, Jumat (22/2/2019). googletag.cmd.push(function() { googletag.display(\'div-gpt-ad-1535944306169-0\'); }); Danu kemudian menegaskan kembali tentang program inklusi keuangan yang selama ini menjadi komitmen TCASH. ""Hadirnya layanan keuangan yang menyeluruh dari LinkAja diharapkan dapat semakin mengakselerasi inklusi keuangan dan mempercepat terbentuknya cashless society yang diusung pemerintah dalam Gerakan Nasional Non-Tunai (GNNT). Selain itu, Linkaja bertujuan untuk melengkapi ekosistem pembayaran digital di Indonesia,"" ujarnya.Baca juga: Pesaing GoPay dan OVO Milik BUMN Keluar Hari Ini?LinkAja akan menggabungkan produk TCASH milik Telkomsel, Yap! milik BNI, e-Cash milik Bank Mandiri dan T-bank dari Bank BRI. Untuk tahap awal, Telkomsel telah mengalihkan TCASH ke Finarya.Dibentuknya Finarya sebagai rumah bagi layanan dompet digital BUMN sudah digodok sejak kuartal III-2018. Fintech ini disiapkan untuk menghadapi Go-Pay dan OVO yang tumbuh pesat kurang dari lima tahun dan membuat produk dompet digital BUMN kurang diminati masyarakat.Dengan penggabungan ini diharapkan BUMN lebih bisa bersaing dengan OVO dan Go-Pay dan maksimal menggarap nasabah dan pelanggan Telkomsel. Saat ini pelanggan T-Cash 30 juta pelanggan sementara pelanggan Telkomsel mencapai 200 juta orang. Bank BUMN juga rata-rata memiliki jumlah nasabah di atas 10 juta orang.""Kita gabung, agar bisa efisien. Jadi promosinya bisa bersama-sama dan tidak duplikasi,"" ujar Deputi Bidang Usaha Jasa Keuangan, Survei dan Konsultasi Kementerian BUMN Gatot Trihargo.Baca juga: BI Siap Keluarkan Izin Saingan GoPay dan OVOSimak juga video Bos Go-Pay Bicara Cashless Society di Innocreativation:[Gambas:Video 20detik] (kil/eds) linkaja tcash gopay ovo fintech <!--// <![CDATA[ OA_show(\'newstag\'); // ]]> --> <!--// <![CDATA[ OA_show(\'hiddenquiz\'); // ]]> -->']"
1,hot,Hobi Vanessa Angel yang Tak Bisa Ditinggalkan Selama di Tahanan,"['Jakarta - Ada kebiasaan Vanessa Angel yang tak bisa ditinggalkan selama ditahan di Polda Jawa Timur. Artis FTV yang disebut terlibat kasus prostitusi online itu senang sekali bersih-bersih.Kabid Humas Polda Jatim Kombes Frans Barung Mangera mengatakan, setiap pagi Vanessa rajin membersihkan kaca jendela. Tak hanya itu, Vanessa juga rajin menyapu lantai selnya.Baca juga: Terus Pertanyakan Kasus Vanessa Angel, Pacar Singgung Jokowi""Vanessa ini sebenarnya rajin ya anaknya, sering membersihkan kalau pagi. Kemudian jendela-jendela kaca juga dibersihkannya, dia menyapu,"" kata Barung kepada detikcom di Surabaya.Barung menegaskan tugas bersih-bersih sebenarnya bukan tugas Vanessa. Namun, Vanessa diketahui sebagai pribadi yang suka kebersihan.Untuk itu, Vanessa memiliki banyak teman di tahanan wanita tersebut. Barung menyebut banyak tahanan lain yang suka berteman dengan Vanessa.Baca juga: Pacar Posting Foto Vanessa Angel Belum Mandi dan \'Telanjang\', Ada Apa?""Tetapi memang itu kan bukan tugasnya dia. Tetapi dia itu orangnya pembersih sehingga banyak juga tahanan yang senang sama dia,"" lanjutnya.Saat ditanya berapa jumlah penghuni sel Vanessa, Barung enggan memaparkan. Namun sebelumnya, pacar Vanessa Febri Ardiansyah atau Bibi mengatakan sel Vanessa diisi 21 tahanan.""Satu sel di tahanan wanita lah, pokoknya di tahanan wanita,"" pungkasnya.Sebelumnya, usai ditetapkan sebagai tersangka kasus penyebaran konten asusila yang melanggar UU ITE, polisi memutuskan untuk menahan Vanessa.Vanessa ditahan sekeluarnya dari RS Bhayangkara pada Senin (4/2/2019). Penahanan Vanessa ini akan dilakukan selama 20 hari.Eits! Pacar Vanessa Angel Tercyduk Dugem Bareng Anya Geraldine, Simak Videonya:[Gambas:Video 20detik] googletag.cmd.push(function() { googletag.display(\'div-gpt-ad-1535944650921-0\'); }); (ken/nkn) vanessa angel prostitusi online pacar vanessa angel vanessa angel ditangkap kasus prostitusi online vanessa angel ditangkap polisi <!--// <![CDATA[ OA_show(\'newstag\'); // ]]> --> Photo Gallery 1 celeb Inisial RP Muncul, Ratna Pandita Merasa Malu celeb Inisial RP Muncul, Ratna Pandita Merasa Malu celeb Inisial RP Muncul, Ratna Pandita Merasa Malu celeb Inisial RP Muncul, Ratna Pandita Merasa Malu celeb Inisial RP Muncul, Ratna Pandita Merasa Malu celeb Inisial RP Muncul, Ratna Pandita Merasa Malu 1 celeb Kembalinya Senyum Della Perez celeb Kembalinya Senyum Della Perez celeb Kembalinya Senyum Della Perez celeb Kembalinya Senyum Della Perez celeb Kembalinya Senyum Della Perez celeb Kembalinya Senyum Della Perez celeb Kembalinya Senyum Della Perez 2 celeb Asal Muasal Nama Della Perez hingga Kasus Prostitusi Online celeb Asal Muasal Nama Della Perez hingga Kasus Prostitusi Online celeb Asal Muasal Nama Della Perez hingga Kasus Prostitusi Online celeb Asal Muasal Nama Della Perez hingga Kasus Prostitusi Online celeb Asal Muasal Nama Della Perez hingga Kasus Prostitusi Online celeb Asal Muasal Nama Della Perez hingga Kasus Prostitusi Online celeb Asal Muasal Nama Della Perez hingga Kasus Prostitusi Online 3 celeb Sang Ayah Buka-bukaan soal Vanessa Angel celeb Sang Ayah Buka-bukaan soal Vanessa Angel celeb Sang Ayah Buka-bukaan soal Vanessa Angel celeb Sang Ayah Buka-bukaan soal Vanessa Angel celeb Sang Ayah Buka-bukaan soal Vanessa Angel 4 celeb Namanya Disebut, Baby Shu Ngaku Tak Pernah Ditawar celeb Namanya Disebut, Baby Shu Ngaku Tak Pernah Ditawar celeb Namanya Disebut, Baby Shu Ngaku Tak Pernah Ditawar celeb Namanya Disebut, Baby Shu Ngaku Tak Pernah Ditawar celeb Namanya Disebut, Baby Shu Ngaku Tak Pernah Ditawar celeb Namanya Disebut, Baby Shu Ngaku Tak Pernah Ditawar 5 celeb Tangis Vanessa Angel Usai Jadi Tersangka celeb Tangis Vanessa Angel Usai Jadi Tersangka celeb Tangis Vanessa Angel Usai Jadi Tersangka celeb Tangis Vanessa Angel Usai Jadi Tersangka celeb Tangis Vanessa Angel Usai Jadi Tersangka celeb Tangis Vanessa Angel Usai Jadi Tersangka celeb Tangis Vanessa Angel Usai Jadi Tersangka 6 celeb Lika-Liku Hubungan Jane Shalimar dan Vanessa Angel celeb Lika-Liku Hubungan Jane Shalimar dan Vanessa Angel celeb Lika-Liku Hubungan Jane Shalimar dan Vanessa Angel celeb Lika-Liku Hubungan Jane Shalimar dan Vanessa Angel celeb Lika-Liku Hubungan Jane Shalimar dan Vanessa Angel celeb Lika-Liku Hubungan Jane Shalimar dan Vanessa Angel celeb Lika-Liku Hubungan Jane Shalimar dan Vanessa Angel 7 celeb Perut Makin Membesar, Nikita Mirzani Bicara Soal Tarif celeb Perut Makin Membesar, Nikita Mirzani Bicara Soal Tarif celeb Perut Makin Membesar, Nikita Mirzani Bicara Soal Tarif celeb Perut Makin Membesar, Nikita Mirzani Bicara Soal Tarif celeb Perut Makin Membesar, Nikita Mirzani Bicara Soal Tarif celeb Perut Makin Membesar, Nikita Mirzani Bicara Soal Tarif celeb Perut Makin Membesar, Nikita Mirzani Bicara Soal Tarif 8 celeb Kimberly Ryder Sebut Tarif Rp 80 Juta Terlalu Murah celeb Kimberly Ryder Sebut Tarif Rp 80 Juta Terlalu Murah celeb Kimberly Ryder Sebut Tarif Rp 80 Juta Terlalu Murah celeb Kimberly Ryder Sebut Tarif Rp 80 Juta Terlalu Murah celeb Kimberly Ryder Sebut Tarif Rp 80 Juta Terlalu Murah celeb Kimberly Ryder Sebut Tarif Rp 80 Juta Terlalu Murah celeb Kimberly Ryder Sebut Tarif Rp 80 Juta Terlalu Murah 9 celeb Ini Jurus Vega Darwanti Agar Tak Ditawar celeb Ini Jurus Vega Darwanti Agar Tak Ditawar celeb Ini Jurus Vega Darwanti Agar Tak Ditawar celeb Ini Jurus Vega Darwanti Agar Tak Ditawar celeb Ini Jurus Vega Darwanti Agar Tak Ditawar celeb Ini Jurus Vega Darwanti Agar Tak Ditawar 10 celeb Pernah Bermusuhan, Jane Shalimar Kini Garda Depan Vanessa Angel celeb Pernah Bermusuhan, Jane Shalimar Kini Garda Depan Vanessa Angel celeb Pernah Bermusuhan, Jane Shalimar Kini Garda Depan Vanessa Angel celeb Pernah Bermusuhan, Jane Shalimar Kini Garda Depan Vanessa Angel celeb Pernah Bermusuhan, Jane Shalimar Kini Garda Depan Vanessa Angel celeb Pernah Bermusuhan, Jane Shalimar Kini Garda Depan Vanessa Angel 11 celeb Berwajah Sedih, Vanessa Angel Keluar dari Polda Jatim celeb Berwajah Sedih, Vanessa Angel Keluar dari Polda Jatim celeb Berwajah Sedih, Vanessa Angel Keluar dari Polda Jatim celeb Berwajah Sedih, Vanessa Angel Keluar dari Polda Jatim celeb Berwajah Sedih, Vanessa Angel Keluar dari Polda Jatim celeb Berwajah Sedih, Vanessa Angel Keluar dari Polda Jatim celeb Berwajah Sedih, Vanessa Angel Keluar dari Polda Jatim celeb Berwajah Sedih, Vanessa Angel Keluar dari Polda Jatim 12 celeb Deretan Kekasih Vanessa Angel Sebelum Tertangkap Prostitusi Online celeb Deretan Kekasih Vanessa Angel Sebelum Tertangkap Prostitusi Online celeb Deretan Kekasih Vanessa Angel Sebelum Tertangkap Prostitusi Online celeb Deretan Kekasih Vanessa Angel Sebelum Tertangkap Prostitusi Online celeb Deretan Kekasih Vanessa Angel Sebelum Tertangkap Prostitusi Online celeb Deretan Kekasih Vanessa Angel Sebelum Tertangkap Prostitusi Online celeb Deretan Kekasih Vanessa Angel Sebelum Tertangkap Prostitusi Online celeb Deretan Kekasih Vanessa Angel Sebelum Tertangkap Prostitusi Online 13 celeb Penampakan Vanessa Angel saat Ditangkap karena Prostitusi Online celeb Penampakan Vanessa Angel saat Ditangkap karena Prostitusi Online celeb Penampakan Vanessa Angel saat Ditangkap karena Prostitusi Online celeb Penampakan Vanessa Angel saat Ditangkap karena Prostitusi Online celeb Penampakan Vanessa Angel saat Ditangkap karena Prostitusi Online 14 celeb Vanessa Angel Lakukan Perawatan, Demi Pacar Barunya? celeb Vanessa Angel Lakukan Perawatan, Demi Pacar Barunya? celeb Vanessa Angel Lakukan Perawatan, Demi Pacar Barunya? celeb Vanessa Angel Lakukan Perawatan, Demi Pacar Barunya? celeb Vanessa Angel Lakukan Perawatan, Demi Pacar Barunya? celeb Vanessa Angel Lakukan Perawatan, Demi Pacar Barunya? 15 celeb Dicatut Prostitusi Online, Dinar Candy Kini Lebih Tertutup? celeb Dicatut Prostitusi Online, Dinar Candy Kini Lebih Tertutup? celeb Dicatut Prostitusi Online, Dinar Candy Kini Lebih Tertutup? celeb Dicatut Prostitusi Online, Dinar Candy Kini Lebih Tertutup? celeb Dicatut Prostitusi Online, Dinar Candy Kini Lebih Tertutup? celeb Dicatut Prostitusi Online, Dinar Candy Kini Lebih Tertutup? celeb Dicatut Prostitusi Online, Dinar Candy Kini Lebih Tertutup? 16 celeb Vanessa Angel Tetap Happy Meski Putus, Ini Alasannya? celeb Vanessa Angel Tetap Happy Meski Putus, Ini Alasannya? celeb Vanessa Angel Tetap Happy Meski Putus, Ini Alasannya? celeb Vanessa Angel Tetap Happy Meski Putus, Ini Alasannya? celeb Vanessa Angel Tetap Happy Meski Putus, Ini Alasannya? celeb Vanessa Angel Tetap Happy Meski Putus, Ini Alasannya? celeb Vanessa Angel Tetap Happy Meski Putus, Ini Alasannya? 17 celeb Gracia Indri Liburan di Amerika, Vanessa Angel Cantik Berkaftan celeb Gracia Indri Liburan di Amerika, Vanessa Angel Cantik Berkaftan celeb Gracia Indri Liburan di Amerika, Vanessa Angel Cantik Berkaftan celeb Gracia Indri Liburan di Amerika, Vanessa Angel Cantik Berkaftan celeb Gracia Indri Liburan di Amerika, Vanessa Angel Cantik Berkaftan celeb Gracia Indri Liburan di Amerika, Vanessa Angel Cantik Berkaftan 18 celeb Vanessa Angel Cantik Berkaftan Biru celeb Vanessa Angel Cantik Berkaftan Biru celeb Vanessa Angel Cantik Berkaftan Biru celeb Vanessa Angel Cantik Berkaftan Biru celeb Vanessa Angel Cantik Berkaftan Biru celeb Vanessa Angel Cantik Berkaftan Biru 19 celeb Dokter Ganteng yang Dekati Ayu Ting Ting, Vanessa Angel Gandeng Pacar celeb Dokter Ganteng yang Dekati Ayu Ting Ting, Vanessa Angel Gandeng Pacar celeb Dokter Ganteng yang Dekati Ayu Ting Ting, Vanessa Angel Gandeng Pacar celeb Dokter Ganteng yang Dekati Ayu Ting Ting, Vanessa Angel Gandeng Pacar celeb Dokter Ganteng yang Dekati Ayu Ting Ting, Vanessa Angel Gandeng Pacar celeb Dokter Ganteng yang Dekati Ayu Ting Ting, Vanessa Angel Gandeng Pacar celeb Dokter Ganteng yang Dekati Ayu Ting Ting, Vanessa Angel Gandeng Pacar celeb Dokter Ganteng yang Dekati Ayu Ting Ting, Vanessa Angel Gandeng Pacar celeb Dokter Ganteng yang Dekati Ayu Ting Ting, Vanessa Angel Gandeng Pacar celeb Dokter Ganteng yang Dekati Ayu Ting Ting, Vanessa Angel Gandeng Pacar celeb Dokter Ganteng yang Dekati Ayu Ting Ting, Vanessa Angel Gandeng Pacar celeb Dokter Ganteng yang Dekati Ayu Ting Ting, Vanessa Angel Gandeng Pacar celeb Dokter Ganteng yang Dekati Ayu Ting Ting, Vanessa Angel Gandeng Pacar 20 1 <!--// <![CDATA[ OA_show(\'hiddenquiz\'); // ]]> -->']"
2,hot,"Resmi Menikah, Ini Transformasi Penampilan Syahrini",['']
