id,kategory,judul,isi1,sport,"Setelah 24 Tahun, Indonesia Gelar MotoGP Lagi","[""Jakarta - Indonesia akan menggelar MotoGP mulai 2021. Setelah 24 tahun, Indonesia kembali menjadi tuan rumah balap motor kelas tertinggi bertaraf internasional lagi.Indonesia sudah meneken kesepakatan dengan Dorna Sport SL, untuk menggelar MotoGP mulai musim 2021. Kontrak berdurasi tiga tahun, yang artinya Indonesia menjadi tuan rumah balapan untuk Marc Marquez dkk sampai 2023.Kepastian itu dikonfirmasi oleh Direktur Utama Indonesia Tourism Development Corporation (ITDC) Abdulbar Mansoer. Ia mengonfirmasi kepada detikSport jika Indonesia dan Dorna Sports SL sudah sepakat menggelar kejuaraan balap motor tersebut. googletag.cmd.push(function() { googletag.display('div-gpt-ad-1535945783791-0'); }); Baca juga: Siapkan Mandalika Tuan Rumah MotoGP Indonesia, Pemerintah Suntik Rp 15 MiliarKesepakatan ini membuat Indonesia akhirnya kembali menggelar balap motor kelas tertinggi bertaraf internasional lagi setelah terakhir kali 24 tahun lalu. Ya, pada 1997, Indonesia pernah menjadi tuan rumah Grand Prix.Ketika itu, Indonesia menjadi tuan rumah kejuaraan pada 1996 dan 1997 untuk semua kelas balapan yakni 500cc, 250cc, dan 125cc. Sirkuit Sentul yang menjadi arena balapannya. Ketika itu, kelas balapan tertingginya masih 500cc, belum MotoGP.Pada 1997 atau tahun terakhir Grand Prix Indonesia digelar, kelas 500cc dimenangi oleh Tadayuki Okada asal Jepang, Max Biaggi memenangi kelas 250cc, dan kelas 125cc dimenangi Valentino Rossi, yang saat ini masih membalap di MotoGP.Baca juga: MotoGP Indonesia Bakal Digelar di Sirkuit Jalan Raya MandalikaKini, ajang balap motor kelas tertinggi akan kembali ke Indonesia, tepatnya di Mandalika, Lombok, Nusa Tenggara Barat. Kepastian ini menjawab penantian pecinta balap motor di Tanah Air yang selalu mendapat ketidakpastian soal gelaran MotoGP dalam beberapa tahun terakhir.Pada 2015, Indonesia sempat dibilang akan menjadi tuan rumah untuk MotoGP 2017 di Sentul, namun akhirnya tidak jelas dan menguap. Kemudian setelahnya, Palembang disebut siap menggelarnya.Namun sama seperti Sentul, MotoGP Palembang juga tinggal wacana. Kini, Mandalika datang dan diklaim siap menjadi tuan rumah kejuaraan motor paling bergengsi itu.Sirkuit Mandalika disebut akan menyiapkan sirkuit jalan raya untuk MotoGP 2021. Menarik ditunggu aksi para rider beradu kecepatan di Indonesia.Baca juga: Tuan Rumah MotoGP Indonesia, Seperti Apa Sirkuit Jalan Raya Mandalika? (yna/din) motogp motogp 2021 motogp indonesia sirkuit mandalika""]"
2,sport,"All Star Seru Banget, Tim LeBron Kalahkan Tim Giannis",['']
3,sport,"Duo London, Chelsea-Arsenal Kompak Tembus 16 Besar Liga Europa",['']
4,sport,"Video Intimnya Tersebar, Ini Si Seksi Nicole Scherzinger",['']
5,sport,"Ultah ke-40, Ini Foto-foto Jadul Valentino Rossi",['']
6,sport,"Dimas Ekky, Pebalap Moto2 yang Harumkan Nama Indonesia",['']
7,sport,"Dugaan Pengaturan Skor Liga 1 2018, Persela Lihat Ada Kejanggalan Saat Laga","['Lamongan - CEO Persela Lamongan, Yuhronur Efendi, merespons kecurigaan pengaturan skor yang melibatkan klub mereka. Manajemen sempat curiga, namun tak bisa berbuat apa-apa. Persela disebut-sebut menjadi salah satu klub yang terlibat pengaturan skor dalam acara Mata Najwa dengan tajuk ""PSSI Bisa Apa Jilid 4"" pada Rabu (20/2/2019) malam WIB. Seorang narasumber yang disebut sebagai perangkat pertandingan sepakbola dan disamarkan identitasnya, mengungkapkan hampir semua pertandingan Liga 1 2018 sudah diatur. Narasumber itu menyebut pertandingan Bali United dengan Persela Lamongan di Stadion I Wayan Dipta pada 11 September 2018 itu sudah diatur untuk kemenangan Bali United. Di akhir pertandingan, laga yang dipimpin oleh wasit Novari Ikhsan Arilaha itu, dimenangkan Bali United 3-2. ""Kami tidak tahu-menahu mengenai kasus (pengaturan skor) pertandingan tersebut,"" kata CEO Persela Lamongan, Yuhronur Efendi, kepada detikSport, Jum\'at (22/2/2019).Baca juga: IB Pengatur Skor Diduga Petinggi Arema FC, Ini Respons ManajemenKendati tidak mengetahui kasus pengaturan skor tersebut, namun Yuhronur menyebut ada sejumlah kejanggalan dalam laga itu. ""Kami terkejut dan menaruh curiga ketika menyaksikan pertandingan tersebut. Tapi, hal itu kan tidak merubah hasil pertandingan yang sudah berlalu itu,"" katanya.Yuhronur menyebut Persela mendukung penuh langkah Tim Satgas Anti Mafia Bola untuk memberantas praktik pengaturan skor. Yuhronur berharap tidak ada lagi praktik kecurangan, baik itu dalam pertandingan Persela atau pertandingan-pertandingan lainnya. ""Kami optimistis jika tidak ada lagi pengaturan skor, ke depan sepak bola kita bisa lebih maju. Sebab hal semacam ini justru mencederai unsur sportivitas dalam dunia olahraga,"" ujar Yuhronur.Baca juga: Pertandingan Persija vs Mitra Kukar Dicurigai Telah Diatur (fem/fem) persela lamongan pengaturan skor satgas anti mafia bola birojatim']"
8,sport,"MotoGP Indonesia, Gini Nih Desain Sirkuitnya di Mandalika",['']
9,sport,"Ini Desain Sirkuit Mandalika, Tuan Rumah MotoGP Indonesia","[""Jakarta - Sirkuit Jalan Raya Mandalika akan menggelar MotoGP Indonesia mulai tahun 2021. Seperti apa layout lintasan yang akan jadi kebangaan Indonesia itu?Seperti diberitakan sebelumnya, Mandalika terpilih menjadi tuan rumah MotoGP Indonesia mulai 2021. Wilayah di Lombok tersebut mengalahkan Sirkuit Sentul dan Palembang yang sebelumnya juga jadi kandidat.Diungkapkan Direktur Utama Indonesia Tourism Development Corporation (ITDC), Abdulbar M. Mansoer, Sirkuit Mandalika akan merupakan sirkuit jalan raya. Sampai musim ini, belum ada tuan rumah MotoGP yang memakai sirkuit jalan raya. googletag.cmd.push(function() { googletag.display('div-gpt-ad-1535945783791-0'); }); Baca juga: Resmi! Indonesia Akan Gelar MotoGP Mulai 2021Dalam layout desain sirkuit yang diterima detikSport, dijelaskan kalau Sirkuit Mandalika akan memiliki panjang 4,32 km. Sirkuit tersebut memiliki satu lintasan lurus, yang sepertinya akan menjadi garis start/finis.Sirkuit akan terdiri dari 18 tikungan. Belum diketahui apakah arah putaran sama dengan jarum jam atau justru berkebalikan. Beberapa sirkuit MotoGP yang arah putarannya berkebalikan dengan jarum jam adalah Austin, Aragon, dan Phillip Island.Layout Sirkuit Mandalika Foto: ist.Untuk sarana penunjang, area paddock akan memiliki 40 garasi untuk operasional tim balap. Sementara kapasitas grand stand mencapai 93.200 tempat duduk. Itu belum termasuk 138.700 area tanpa tempat duduk dan hospitality suites yang mampu menampung 7.700 penonton. (yna/din) motogp indonesia sirkuit mandalika mandalika motogp""]"
10,sport,"MotoGP Indonesia di 2021, Rossi Masih Balapan?","[""Jakarta - MotoGP Indonesia rencananya akan dimulai 2021. Pertanyaannya kini, apakah publik Indonesia masih bisa melihat aksi Valentino Rossi dua tahun lagi?Indonesia sudah meneken kesepakatan dengan Dorna Sport SL, untuk menggelar MotoGP mulai musim 2021. Kontrak berdurasi tiga tahun, yang artinya Indonesia menjadi tuan rumah balapan untuk Marc Marquez dkk sampai 2023.Untuk pertama kalinya sejak 1997, Indonesia akan jadi tuan rumah balapan kelas primer tersebut. Saat masih berformat GP 500cc, Indonesia dua kali menggelar balapan setelah pertama tahun 1996. googletag.cmd.push(function() { googletag.display('div-gpt-ad-1535945783791-0'); }); Baca juga: Resmi! Indonesia Akan Gelar MotoGP Mulai 2021Tentunya fans Indonesia akan sangat menantikan realisasi sebenarnya dari balapan MotoGP 2021 yang rencananya akan digelar di sirkuit jalan raya Mandalika, Lombok Timur, Nusa Tenggara Barat.Selain itu, para penggila MotoGP tentunya ingin menyaksikan aksi Rossi di lintasan secara langsung, setelah selama ini lebih banyak melihat lewat layar kaca. Ya, Rossi masih jadi magnet utama untuk balapan MotoGP meski sudah berumur 40 tahun.Tapi, pertanyaan besar adalah apakan Rossi nantinya masih membalap di MotoGP? Memang Rossi tetap membalap di musim 2019 ini bersama Yamaha yang juga jadi musim ke-19-nya di ajang ini.Baca juga: Setelah 24 Tahun, Indonesia Gelar MotoGP LagiMeski begitu, melihat performa Rossi belakangan ini yang mulai menurun, fans mulai khawatir bahwa Rossi sudah menyerah mengejar gelar juara dunia dan ingin pensiun menikmati masa tuanya. Memang Rossi belum berikrar kapan akan gantung helm, tapi dengan usianya saat ini, maka hal itu tinggal menunggu waktu saja.Bapak Rossi, Graziano, beberapa waktu lalu sempat mengungkapkan harapan bahwa sang anak akan tetap membalap sampai usia 46 tahun, sama seperti nomor favoritnya di motor.Sebagai catatan, pebalap tertua yang pernah memenangi balapan MotoGP adalah Fergus Anderson pada usia 44 tahun 237 hari di MotoGP Spanyol 1953. Apakah Rossi bisa membalap sampai setua itu? Kita tunggu saja.Baca juga: 'Rossi Bisa Balapan Hingga 46 Tahun' (mrp/din) valentino rossi motogp indonesia motogp""]"
11,sport,Mimpi MotoGP Gelar Balapan Jalan Raya Terwujud di Indonesia,"['Jakarta - MotoGP sempat melontarkan wacana menggelar balapan jalan raya. Kini, hal itu akan terwujud di Indonesia, di MotoGP 2021.Beberapa waktu lalu, CEO Dorna Sports SL Carmelo Ezpeleta mengungkapkan telah menerima proposal untuk menggelar balapan di \'kota yang hangat\'. Balapan akan bersifat urban race atau balapan di tengah kota.Ketika itu, Ezpeleta menyiratkan soal kemungkinan membuat sirkuit di tengah kota untuk balapan. googletag.cmd.push(function() { googletag.display(\'div-gpt-ad-1535945783791-0\'); }); Baca juga: Bukan Sentul dan Palembang, MotoGP Indonesia Akhirnya Digelar di Mandalika""Mungkin saja ada sirkuit perkotaan di MotoGP. Ada proyek yang solid di kota yang hangat,"" kata Ezepeleta kepada Expansion yang dilansir Autosport, 19 Januari 2018.""Secara teori, lintasan utama trek akan berada di jalan raya dan paddock-nya akan tertutup, terintegrasi dengan pusat ekshibisi. Untuk pekan grand prix itu bisa digunakan untuk race, dan digunakan untuk banyak hal lainnya di di sisa tahun,"" jelasnya.Kini, ucapan Ezpeleta akan terwujud di Indonesia. Sirkuit Mandalika di Lombok, Nusa Tenggara Barat, tengah disiapkan untuk menggelar balapan Marc Marquez dkk.Ya, Indonesia disebut telah sepakat dengan Dorna Sport SL untuk mengelar MotoGP mulai 2021. Kontrak berdurasi tiga tahun atau sampai 2023 didapat untuk menggelar balapan di Sirkuit Mandalika.Baca juga: Setelah 24 Tahun, Indonesia Gelar MotoGP LagiNantinya, Sirkuit Mandalika akan berkonsep street race circuit layaknya di Singapura dan Monako. Trek yang disebut akan punya panjang 4,32 km dan 18 tikungan itu bisa digunakan untuk harian dan balapan MotoGP.Trek akan dibangun mulai Oktober mendatang, dan diprediksi rampung pada 2020, sebelum dipakai untuk menggeber motor balap para rider top dunia. Indonesia Tourism Development Corporation (ITDC) mengklaim tengah menyiapkan dana sebesar Rp 3,6 triliun untuk sirkuit tersebut.Baca juga: Ini Desain Sirkuit Mandalika, Tuan Rumah MotoGP Indonesia (yna/mrp) motogp indonesia motogp 2021 sirkuit mandalika motogp dorna sports']"
12,sport,Menengok Balapan GP500cc Indonesia 1996 di Sentul,['']
13,sport,"Soal MotoE, Marquez: Aneh Lihat Motor Tak Berisik","['Bandung - MotoE menjadi balapan kelas baru yang dipentaskan FIM. Juara dunia MotoGP, Marc Marquez, menilai motornya aneh sebab tidak berisik.MotoE mulai akan diperlombakan tahun di 2019. 12 tim yang ambil bagian dan diikuti 18 pebalap, di antaranya adalah mantan dua rider MotoGP Sete Gibernau dan Randy de Puniet.MotoE di 2019 akan digelar sebanyak 5 seri. Balapan akan digelar di Jerez, Prancis, Jerman, Austria, dan San Marino. Tahun lalu, MotoE sudah diuji coba di Sirkuit Catalunya. googletag.cmd.push(function() { googletag.display(\'div-gpt-ad-1535945783791-0\'); }); Baca juga: Daftar Pebalap MotoE 2019: Banyak Rider Jebolan MotoGPMotor listrik bisa dibilang menjadi pendekatan baru dunia balap motor. Direktur Honda Racing Corporation, Tetsuhiro Kuwata, menilai pihaknya masih akan mengamati perkembangannya.""Itu merupakan pendekatan yang berbeda pada balap motor, baru poin awal untuk pendekatan ini. Tentunya kami mempertimbangkan pendekatan ini untuk masa depan. Bagi kami masih terlalu dini, mari tunggu saja apa yang akan terjadi di MotoE, kami mempertimbangkan itu untuk masa depan,"" ujar Kuwata dalam wawancara di acara Repsol Honda Team Visit Indonesia 2019.Baca juga: Ini Spesifikasi MotoE dan Perbandingan Top Speed dengan MotoGPMarquez, yang berstatus juara dunia MotoGP lima kali, juga berkomentar soal MotoE. Ia menilai motornya aneh sebab tidak bising layaknya kuda besi MotoGP.""Seperti yang dikatakan Pak Kuwata, untuk saat ini, itu untuk masa depan. Saat sampai pada saatnya kita semua akan mengetahuinya, untuk saat ini kami akan mengikuti kategori itu. Akan aneh melihat beberapa motor tanpa mengeluarkan suara seperti biasa,"" kata Marquez.""Saya menikmati menunggangi motor yang sekarang. Saya sudah menjajal motor elektrik. Kalau Honda mempersiapkan satu, saya akan mencobanya. Tapi untuk saat ini kami terus di MotoGP, yang sangat saya nikmati,"" dia menambahkan. (cas/yna) marc marquez repsol honda motoe']"
14,sport,Jelang Final Piala Liga Inggris: Man City Mengejar Rekor MU,"['Jakarta - Sebuah torehan berpotensi diukir Manchester City andai memenangi final Piala Liga Inggris. City akan menyamai rekor rival sekotanya, Manchester United.City akan memenuhi tantangan Chelsea dalam pertandingan yang digelar di Stadion Wembley, Minggu (24/2/2019) malam WIB. Kedua tim sama-sama sudah mengoleksi lima trofi Piala Liga dan kini mengincar yang keenam.City berstatus juara bertahan setelah menundukkan Arsenal 3-0 pada final 2018. Opta mengemukakan bahwa the Citizens akan menjadi tim keempat yang bisa memenangi trofi juara ini secara beruntun setelah Manchester United dua kali berturut-turut pada 2009 dan 2010, Liverpool (1981-1984), dan Nottingham Forrest (1978 dan 1979). Baca juga: Jelang Final Piala Liga Inggris: Wembley Tak Bertuah untuk Chelsea""Akan berarti banyak untuk sejarah klub,"" gelandang City Bernardo Silva mengatakan dilansir the Guardian.Baca juga: Inggris Panas! MU-Liverpool di Premier League, Chelsea-City di Final Piala Liga""Itu adalah satu dari target utama kami: bukan cuma memenanginya sekali tapi terus menang dan menang. Kami tahu kami punya skuat untuk melakukannya tapi lawan kami juga sangat tangguh dan mestinya tidak akan mudah.""Sejak dibesut Josep Guardiola di 2016/17, City sukses memenangi empat dari lima pertemuan terakhir dengan Chelsea di seluruh kompetisi. Satu-satunya kekalahan itu diderita di Stamford Bridge dengan skor 0-2 pada lanjutan Premier League, Desember 2018.City memenangi Piala Liga Inggris pada 1969/70, 1975/76, 2013/14, 2015/16, dan 2017/18. (rin/raw) final piala liga inggris 2019 chelsea vs manchester city piala liga inggris chelsea manchester city']"
15,sport,"Jangan Khawatir, Bahu Marquez Terus Membaik Kok","['Bandung - Rider Repsol Honda, Marc Marquez, menyebut proses pemulihan cedera bahunya berjalan dengan baik. Buktinya tes Sepang dilalui dengan mulus.Marquez sedang menjalani proses pemulihan cedera bahu usai operasi pada awal Desember lalu. Dia mengalami cedera lagi sejak MotoGP Jepang pada Oktober 2018.Sempat istirahat total selama dua bulan, Marquez sudah kembali ke lintasan pada awal bulan ini. Pebalap 25 tahun itu sudah membuktikan performa yang cukup oke dengan menjadi yang tercepat pada hari pertama tes Pramusim MotoGP di Sepang, Malaysia. googletag.cmd.push(function() { googletag.display(\'div-gpt-ad-1535945783791-0\'); }); Baca juga: Marquez: Butuh Menangi 6-7 Seri untuk JuaraPertanyaan mengenai kondisi Marquez menjelang musim baru dimulai pada 10 Maret nanti. Sebelum itu, masih ada satu tes resmi lagi yang juga akan digelar di sirkuit Losail pada 23 Februari.""Memang tak sebaik yang kuharapkan, tapi lebih bagus daripada yang dibilang dokter. Karena aku sangat positif dan akan lebih bagus dari yang kurasakan,"" kata Marquez dalam perbincangan di sela-sela acara Repsol Honda Visit Indonesia 2019.""Tapi pemulihan ini menuju ke arah yang tepat aku merasa baik-baik saja saat mengendarai motor di hari terakhir.""Baca juga: Masukan Marc Marquez untuk Para Pebalap AHRT""Mereka mungkin khawatir bahwa tes Sepang akan membuat bahuku stress yang bisa mempengaruhi pemulihan yang berjalan baik.""""Aku pikir ini tes yang baik. Hari kedua merupakan yang tersulit dengan kondisiku, pada hari ketiga aku merasa sangat baik. Kami cepat di lintasan, kami mencoba hal yang paling penting di motor Honda saat di Sepang.""""Kini kami mempunyai waktu dua pekan sebelum tes Qatar, tapi target utama kami balapan di Qatar. Masih ada waktu sebulan lagi. Aku merasa di Malaysia kami sudah mencapai level yang bagus. Jadi tugas kami untuk terus bekerja keras,"" dia menambahkan.Baca juga: \'Satu Hati\' Menempel di Motor Repsol Honda Lebih Lama (cas/mrp) marc marquez repsol honda motogp 2019 motogp']"
16,sport,"Jorginho Dicemooh Fans Chelsea, Sarri Pasang Badan","['London - Maurizio Sarri membela Jorginho yang dicemooh fans Chelsea di laga kontra Malmo. Menurutnya gelandang 27 tahun ini punya peran penting bagi The Blues.Chelsea menang 3-0 atas Malmo di leg kedua babak 32 besar Liga Europa, Jumat (22/2/2019) dini hari WIB. Kemenangan di Stamford Bridge tersebut sekaligus memastikan The Blues melaju ke babak 16 besar. Mereka unggung agregat 4-1 dari wakil Swedia tersebut.Di laga ini, Maurizio Sarri memilih untuk tak menurunkan Jorginho sejak menit awal. Pemain asal Italia baru masuk bermain di menit ke-76 saat menggantikan Ross Barkley. Keputusan Sarri tersebut diduga berkaitan dengan The Blues yang akan berhadapan dengan Manchester City di final Piala Liga Inggris, Minggu (24/2/2019). Mantan pelatih Napoli ini tentu ingin Jorginho tampil dalam kondisi terbaik dalam duel akhir pekan nanti.Namun ketika menginjakan kaki di lapangan Jorginho justru mendapat cemoohan dari para pendukung Chelsea. Fans The Blues sepertinya masih kecewa dengan buruknya performa sang playmaker dalam beberapa laga terakhir.Baca juga: Tanggapi Rumor Pemecatan, Sarri: Musim Chelsea Lebih Baik dari ArsenalSeusai laga, Sarri berusaha untuk membela Jorginho. Menurutnya pertandingan kontra Malmo akan lebih mudah bagi Chelsea jika gelandang 27 tahun ini tampil sejak awal.""Saya pikir dalam 30 menit pertama kami mengerti mengapa Jorginho sangat penting bagi tim kami. Kami dalam kesulitan untuk keluar dari wilayah kami karena tertekan,"" ujar Sarri dilansir dari The GuardiansDengan Jorginho, saya pikir akan lebih mudah. Saya harap para penggemar kami dapat memahami bahwa Jorginho, bagi kami, benar-benar pemain yang sangat penting,"" ungkapnya.Jorginho didatangkan Sarri musim panas ini dari Napoli senilai 57 juta pound sterling (Rp 1,04 triliun). Ia tampil menjanjikan awal musim ini sebagai sentral dalam peragaan Sarriball.Tapi sejalan dengan memburuknya performa tim London Biru dalam beberapa laga terakhir. Penampilan Jorginho juga ikutan menurun.Baca juga: Mematikan Jorginho, Melumpuhkan Chelsea (cas/ran) jorginho chelsea liga europa']"
17,sport,Joko Driyono: Beri Waktu Agar PSSI Jalankan KLB dengan Ideal,"['Jakarta - Plt Ketua Umum PSSI, Joko Driyono, menyebut pemilihan pengurus dilakukan dalam kondisi ideal. Makanya, dia minta publik jangan terlalu menekan. PSSI diguncang dugaan pengaturan skor. Dua bulan sejak dibentuk, Satgas Anti Mafia Bola menetapkan 15 tersangka, termasuk Jokdri, sapaan karib Joko Driyono. Satgas malah sudah menahan dua tersangka dari petinggi PSSI lain, Johar Lin Eng (anggota exco dan ketua asosiasi provinsi PSSI Jawa Tengah) dan Dwi Irianto (anggota komisi disiplin PSSI) Setelah Jokdri ditetapkan sebagai tersangka perusakan barang bukti dugaan pengaturan skor, PSSI pun krisis kepemimpinan. Lewat rapat darurat anggota Komisi Eksekutif, PSSI menetapkan menggelar Kongres Luar Biasa (KLB) untuk menentukan ketua umum. Waktunya, sesuai dengan permintaan mayoritas pemillik suara saat Edy Rahmayadi mundur dari kursi ketua umum, usai pemilihan presiden. Baca juga: Joko Driyono Menghitung HariJokdri juga bilang PSSI membutuhkan waktu untuk menjaring bakal calon ketua umum. Juga menyeleksi pengurus lain. ""Road map KLB yang direncanakan tentu berharap agar prosesnya berjalan ideal. Misalnya saja, dalam konteks pemilihan kepengurusan baru, penting untuk diproteksi agar organisasi memiliki waktu yg ideal untuk menjaring, melihat, dan menilai pengurus baru yang akan datang,"" kata Jokdri usai diperiksa Satgas Anti Mafia Bola di Polda Metro Jaya, Jumat (22/2/2019). ""Demikian juga kepada mereka yang ingin mengabdikan dirinya menjadi ketum, waketum, atau exco yg baru memiliki waktu yang cukup juga untuk memaparkan visinya, mempersiapkan dirinya agar fit dengan keinginan organisasi,"" dia menambahkan. KLB PSSI normalnya digelar empat tahun sekali. Agenda utama KLB untuk memilih ketua umum baru. Baca juga: Diperiksa 22 Jam, Joko Driyono: Melelahkan, tapi Nyaman (mcy/fem) joko driyono kongres luar biasa pssi joko driyono tersangka pssi satgas anti mafia bola pengaturan skor']"
18,sport,"Firmansah Jadi Tajam, Salah: Terima Kasih Klopp!","['Liverpool - Mohamed Salah mengapresiasi kerja Juergen Klopp yang membuat lini depan Liverpool menjadi tajam. Salah pun jadi seperti sekarang gara-gara Klopp.Salah jadi anggota terakhir trio Firmansah yang direkrut Liverpool setelah Roberto Firmino dan Sadio Mane. Ketiganya mencetak lebih dari 90 gol di seluruh kompetisi musim lalu.Tak cuma membawa Liverpool finis empat besar, final Liga Champions juga dijejaki meski akhirnya dikalahkan Real Madrid. Tapi, hal itu tidak mengurangi puja-puji untuk ketajaman trio Salah, Firmino, dan Mane. Baca juga: Gara-gara Komentari Wasit, Klopp Didenda Rp 825 JutaMemasuki musim keduanya bersama-sama, ketajaman trio Firmansah memang berkurang karena Salah baru bikin 20 gol musim ini di seluruh kompetisi, termasuk 17 gol di Premier League, lalu Mane dengan 13 gol, dan Firmino dengan 11 gol.Meski demikian, dari sisi keseluruhan tim, permainan Liverpool lebih berimbang dan trio lini depan itu lebih saling mengisi satu sama lain musim ini. Bahkan Salah beberapa kali dimainkan sebagai nomor sembilan, sementara Firmino justru sebagai nomor 10 alias gelandang serang.Dengan makin berkembangnya performa Salah dan juga kedua rekannya di lini serang, Klopp pun dianggap sebagai sosok yang paling berperan dalam kemajuan permainan mereka.Baca juga: MU Kini Lebih Ofensif, Liverpool Bisa Diuntungkan""Saya rasa dia (Klopp) membangun tim, dia membuat tim ini mampu bersaing di Premier League. Musim lalu kami bersaing di Liga Champions, jadi saya memberinya kredit lebih,"" ujar Salah kepada ESPN Brasil.""Dia membuat permaian lebih mudah untuk kami. Dia tahu bagaimana merotasi posisi setiap saat ini. Saya kadang bermain di posisi nomor 9, kadang di sayap, kadang di sisi kiri. Kami sangat klik. Kami adalah trio lini depan dan kami tahu bagaimana saling membantu satu sama lain,"" sambungnya.Ketajaman trio lini depan itu diharapkan bisa berlanjut saat melawat ke Old Trafford akhir pekan ini menghadapi Manchester United. The Reds butuh kemenangan untuk bisa kembali ke puncak klasemen.Baca juga: Jadwal Liga Inggris dan Final Piala Liga Pekan Ini (mrp/din) mohamed salah juergen klopp liverpool liga inggris 2018/2019 liga inggris']"
19,sport,Joko Driyono Menghitung Hari,"['Jakarta - PSSI sudah menetapkan akan melakukan pemilihan kepengurusan baru. Joko Driyono pun menanti detik-detik terakhir di organisasi tersebut.Plt Ketua Umum PSSI, Joko Driyono, telah dinyatakan sebagai tersangka perusakan barang bukti milik Satgas Anti Mafia Bola. Status itu membuat Komite Eksekutif (Exco) PSSI melakukan emergency meeting dan memutuskan menggelar Kongres Luar Biasa (KLB).KLB tersebut nantinya akan memilih kepengurusan baru di PSSI. Joko menyampaikan bahwa PSSI sudah menyiapkan road map dan kini dia menanti detik-detik akhir karier di PSSI. Baca juga: Diperiksa 22 Jam, Joko Driyono: Melelahkan, tapi Nyaman""Penting saya ulangi sebagaimana keputusan rapat exco dua hari lalu, bahwa PSSI sudah menyiapkan road map untuk kongres pemilihan kepengurusan baru melalui tahapan KLB, yang akan menetapkan Komite pemilihan dan komite banding pemilihan, dan menetapkan tanggal kapan pemilihan kepengurusan baru,"" kata Joko di Polda Metro Jaya, Jumat (22/2/2019) pagi WIB.""Saya secara pribadi membayangkan layaknya menunggu detik-detik terakhir di dua terminal penting, mengakhiri kepengurusan sekaligus menyongsong keputusan proses hukum ini,"" sambungnya.""Dalam masa itu saya ingin mengabdikan waktu yang ada terproses dan semua aktivitas organisasi bisa berjalan sebaik-baiknya.""Baca juga: Diperiksa 9 Jam, Ratu Tisha Ditanya Soal Administrasi PSSIPria yang akrab disapa Jokdri itu baru saja menyelesaikan pemeriksaan lanjutan terkait kasusnya. Dia diperiksa selama 22 jam sejak Kamis (21/2/2019) dan baru selesai keesokan harinya pukul 08.05 WIB.Jokdri mengaku lelah menjalani pemeriksaan yang panjang, namun dia tak akan istirahat dan tetap bekerja dengan normal untuk PSSI.""Bisa saja akan ada pertemuan berikutnya untuk melengkapi data-data yang dirasa kurang dan saya siap melakukan pemeriksaan berikutnya,"" ungkapnya.""(Aktivitas) normal menjalankan tugas-tugas publik sebagaimana biasanya,"" tegasnya. (mcy/ran) joko driyono pssi']"
