id,kategory,judul,isi57,sport,"Dorna Beri Kesempatan Indonesia Gelar MotoGP Selama 5 Tahun, Apa Alasannya?","['Jakarta - Indonesia mendapat durasi kontrak menggelar MotoGP selama lima tahun. Apa alasan Dorna mau memberi durasi kontrak selama itu?Dorna telah resmi mengumumkan bahwa Indonesia akan menggelar MotoGP mulai 2021. Bersama ITDC (Indonesia Tourism Development Corporation), keduanya sepakat menjalin kerjasama sampai lima tahun mendatang. CEO ITDC, Abdulbar M. Mansoer, mengungkapkan alasan Dorna memberi durasi kontrak sampai lima tahun. Itu karena Indonesia punya pasar MotoGP yang sangat seksi. googletag.cmd.push(function() { googletag.display(\'div-gpt-ad-1535945783791-0\'); }); Baca juga: Indonesia Gelar MotoGP, Max Biaggi Kenang Balapan di Sentul""Selain itu (sebagai pasar), mungkin mereka melihat kami adalah BUMN. Kalau Buriram (Thailand) yang saya dengar swasta,"" kata Abdulbar di Kantor Kemenpora, Senayan, Senin (25/2/2019). ""Hal lain mungkin kami pengembang pariwisata, di Nusa Dua sudah 30 tahun. Kami sih senang untuk jangka panjang artinya kepastian pengembalian investasinya lebih bagus,"" ujar dia kemudian. Abdulbar juga mempertegas bahwa aturan infrastuktur (jalan-jalan dasar) di Mandalika membutuhkan biaya Rp 4,5 triliun. Sekalipun ada yang mengabarkan Rp 40 triliun itu untuk seluruh kawasannya.""Untuk hotel semua selesai, (anggarannya) bisa 10 kalinya. MotoGP masih dihitung, belum tahu angka, itu domain investor saya. Saya pemilik tanah dan yang punya lisensi, yang bangun budget dari Vinci,"" kata dia. Baca juga: Kemenpora Siap Dukung Penuh MotoGP 2021Vinci Construction Grands Projects, merupakan perusahaan asal Prancis yang bergerak di bidang jasa konstruksi, yang memberikan investasi sebesar 1 miliar dollar AS selama 15 tahun dalam bentuk blanket agreement untuk pembangunan distrik hiburan dan olahraga terpadu di Kawasan Ekonomi Khusus Mandalika, NTB.""Mereka blaket agreement besar, jadi dilihat mana yang didahulukan. Kalau sekarang MotoGP, bisa lebih cepat, bisa pas 15 tahun,"" dia menjelaskan. (mcy/ran) motogp motogp mandalika']"
58,sport,"Sani Rizki, Jimat Keberuntungan Timnas Indonesia U-22 Berpangkat Bripda","['Jakarta - Sani Rizki Fauzi mencetak satu gol kemenangan Indonesia di final Piala AFF U-22. Pemuda asal Sukabumi itu masih aktif sebagai anggota Polisi berpangkat bripda.Indonesia keluar sebagai juara Piala AFF U-22 2019 setelah mengalahkan Thailand 2-1 pada laga yang digelar di Stadio Phnom Penh, Kamboja, Selasa (26/2/2019). Dua gol kemenangan Garuda Muda dicetak oleh Sani dan Osvaldo Haay.Sani mampu menyamakan kedudukan tak lama setelah Thailand lebih dulu menjebol gawang Indonesia. Sani memecah kebuntuan tim-tim di Piala AFF U-22 yang selalu gagal menjebol gawang Thailand. Untuk diketahui, di empat pertandingan sebelumnya Thailand selalu clean sheet. googletag.cmd.push(function() { googletag.display(\'div-gpt-ad-1535945694694-0\'); }); Baca juga: Tanpa Ketum PSSI, Indonesia Bisa JuaraKini berusia 21 tahun, perjalan Sani menembus Timnas Indonesia bisa terbilang cepat. Penampilannya bersama Bhayangkara FC U-19 membuat dia naik kelas ke tim senior.Peran Simon McMenemy terhadap karier Sani sangat besar. Dia kerap memberikan kepercayaan terhadap Sani tampil membela Bhayangkara FC. Selama Liga 1 2018, dia main 18 kali dengan sumbangan satu gol. Total dia mencatatkan 1.068 menit bermain semusim lalu.Sani sudah menyukai sepakbola sejak kecil. Sosok ibu yang sangat mendukung Sani menjadi pesepakbola. Untuk mengembangkan bakatnya, dia dimasukkan ke SSB PSPB Cicurug untuk menimba ilmu sepakbola.Indonesia jadi juara Piala AFF U-22 Foto: Antara FotoBaca juga: Kejutan untuk Timnas Indonesia U-22: Bonus Rp 2,1 MiliarMemasuki jenjang SMP, Sani mendapatkan kesempatan direkrut oleh Urakan FC, sebuah tim amatir dari Jakarta Timur. Dia tampil di turnamen Piala Soeratin.Bersama Urakan FC, kemampuan Sani tambah meningkat dan terasah. Bakatnya di atas lapangan membuat pemain asal Sukabumi akhirnya mendapatkan beasiswa untuk menempuh pendidikan olahraga di PPLP Ragunan pada 2015.Setahun kemudian setelah lulus dari PPLP Ragunan, Sani diterima menjadi siswa Kepolisian di SPN Lido pada 2016. Tujuh bulan menjalani pendidikan, dia memiliki gelar alias berpangkat Bripda Sani Rizki FauziSani pun bermain untuk Bhayangkara FC. Kepercayaan Simon memberikan jam terbang kepadanya membuat karier Sani meningkat. Pelatih Skotlandia itu selalu menyebut Sani sebagai \'jimat pembawa keberuntungan\'.Baca juga: Tentang Perayaan Gol Tutup Telinga dari Osvaldo HaayKenapa? karena Simon menilai setiap kali dia memainkan Sani, Bhayangkara FC selalu bisa meraih kemenangan. Mobilitasnya yang tinggi juga sangat membantu Bhayangkara FC.""Sani pemain yang sangat bagus juga, dalam usianya yang sekarang dia bermain dengan sangat bagus, dia bisa bertahan dan dia juga sangat kuat bertahan,"" ujar Simon beberapa waktu lalu.Foto: Dok. PSSI""Sani juga seperti jimat keberuntungan buat kami. Saat melawan Persipura Jayapura, Persib Bandung, dan sekarang PSMS Medan, Sani bermain bagus dan menang,"" tambahnya.Kini, Sani sangat bersyukur bisa mencatatkan satu gol untuk Indonesia. Dia tak pernah menyangka bisa membuat sejarah bersama Timnas.""Alhamdulillah. Tidak bisa diungkapkan dengan kata-kata. Saya bersyukur atas hasil yang maksimal di Piala AFF 2019. Saya sangat bersyukur,"" ujar Sani di Kamboja.""Saya hanya bekerja keras di setiap pertandingan. Tidak menyangka bisa mencetak gol di final. Alhamdulillah mungkin Allah memberi rezeki buat saya,"" katanya menambahkan. (ads/din) sani rizki timnas indonesia u-22 piala aff u-22 indonesia juara piala aff u-22']"
59,sport,"Jelang All England, Jonatan Siapkan Strategi Lawan Lee Dong Keun","['Jakarta - Jonatan Christie melakoni persiapan jelang laga pertama di All England 2019. Jonatan masih gampang membuat kesalahan sendiri.Jonatan akan menghadapi pemain Korea, Lee Dong Keun, di babak pertama turnamen All England. Peraih medali emas Asian Games 2018 itu berada di half yang sama dengan pebulutangkis nomor satu Kento Momota dan unggulan ketujuh Srikanth Kidambi.Melawan Dong Keun, kedua pebulutangkis sudah tiga kali berjumpa di mana Jonatan kalah head to head 1-2. Pertandingan terakhir mereka ditandai dengan kemenangan Dong Keun 21-18, 21-16 di perempatfinal Singapura Terbuka 2017. googletag.cmd.push(function() { googletag.display(\'div-gpt-ad-1535945783791-0\'); }); Baca juga: Bukan Soal Jonatan Dikalahkan Vito yang Bikin Pusing Pelatih, tapi...Pelatih tunggal putra Hendry Saputra Ho mencatat Jonatan masih kurang berani untuk mengambil keputusan saat di momen krusial pertandingan. ""Persiapan engga ada yang penting melihat drawingnya. Jangan terlalu jauh juga. Misalnya, Jonatan ketemu Dong Keun. Ya, kami siapkan dengan tipe permainan dengan kondisi itu dari segala teknik dan mentalnya,\' kata Hendry kepada detikSport, Selasa (26/2/2019). Baca juga: PBSI Umumkan Pelatih Utama Tunggal Putri Usai All England""Untuk mainnya Jonatan sudah oke. Tapi saat di angka-angka penting dia masih gampang mati dan eror. Hal-hal seperti itu yang harus disadari para pemain,"" ujar dia. ""Makanya ini pulihkan kondisi dulu baru nanti fokus kepada persiapan teknik menghadapi lawannya nanti. Satu-satu. Simulasi tidak bisa lagi dilakukan karena sudah tidak ada waktu,"" ungkap dia kemudian. Turnamen All England 2016 akan dimulai pada 6 Maret mendatang. (mcy/rin) jonatan christie all england']"
60,finance,Harga Tiket Pesawat (Masih) Mahal,"[""Jakarta - Presiden Joko Widodo (Jokowi) telah meminta bawahannya mencari formula yang tepat agar harga tiket pesawat bisa segera diturunkan. Namun berselang dua minggu instruksi tersebut disampaikan tampaknya harga tiket pesawat belum kunjung turun.Sebelumnya maskapai Garuda Indonesia Group telah mengumumkan telah memangkas 20% harga tiket yang berlaku pada saat itu. Namun harga tiket sampai saat ini dirasa masih cukup tinggi.Hal tersebut dikonfirmasi oleh mayoritas masyarakat hingga agen biro perjalanan wisata Indonesia. Harga tiket pesawat saat ini masih tinggi, terutama untuk rute-rute favorit seperti Bali, Yogyakarta dan Surabaya.Bagaimana fakta mengenai harga tiket pesawat terkini? Berikut ulasan lengkapnya: (eds/ang) tiket pesawat mahal harga tiket pesawat mahal kemenhub <!--// <![CDATA[ OA_show('newstag'); // ]]> --> <!--// <![CDATA[ OA_show('hiddenquiz'); // ]]> --> Sebelumnya Aturan Baru Taksi Online Berlaku Juni, Ada Sanksi Buat yang Nakal 1 / 5 Selanjutnya Harga Tiket Masih Mahal""]"
61,sport,"Balapan Kurang dari 2 Minggu, Ini PR Yamaha Menurut Vinales","['Losail - Maverick Vinales cukup puas dengan hasil tes pramusim MotoGP di Qatar. Meski demikian, jika ingin memenangi balapan, Yamaha masih harus melakukan perbaikan.Vinales menutup tes MotoGP Qatar dengan menjadi yang tercepat. Dalam sesi di Sirkuit Losail, Senin (25/2/2019), rider Monster Yamaha itu mencatatkan waktu 1 menit 54,208 detik.Itu berarti Vinales tak pernah keluar dari tiga besar selama tiga hari tes di Losail. Pada hari pertama, Vinales jadi yang tercepat dan kemudian ada di posisi kedua di hari berikutnya. googletag.cmd.push(function() { googletag.display(\'div-gpt-ad-1535945783791-0\'); }); Baca juga: Vinales Tercepat di Hari Terakhir Tes MotoGP QatarVinales mengaku sudah sangat nyaman di atas motor YZR-M1. Meski demikian, dengan balapan pertama yang sudah menanti pada 10 Maret di Losail, ia menilai Yamaha masih harus memperbaiki persoalan akselerasi.""Saya merasa benar-benar oke di atas motor. Tapi tetap saja, kalau ingin meraih kemenangan, kami butuh sedikit lebih banyak cengkeraman,"" ujar Vinales seperti dilansir Crash.""Motornya luar biasa, sasis Yamaha, seperti yang Anda tahu, selalu bagus. Tapi sekarang waktunya memperbaiki elektronik, aliran power. Sayang sekali kami tidak ada tes lagi.""""Saya mencoba 10 lap di akhir. Sangat dingin untuk ban medium, tapi saya mengendarai dengan cukup bagus. Ritme yang bagus dan mungkin saya bisa sedikit memaksa.""""Meski demikian, masih ada masalah akselerasi, kami tidak punya cengkeraman di pingir dan saya kira sangat penting melakukan peningkatan untuk balapan,"" katanya.Baca juga: Marquez: Honda dalam Level Bersaing untuk Podium di Balapan Pertama (nds/nds) motogp maverick vinales']"
62,hot,Bella Luna dan Suami Dilaporkan Polisi hingga Trailer 'My Stupid Boss 2',"['Jakarta - Pemberitaan terpopuler detikHOT sepanjang Sabtu (23/2/2019) diwarnai oleh kabar Bella Luna dan suami yang dilaporkan ke polisi. Serta trailer dan poster resmi dari film \'My Stupid Boss 2\' yang baru saja dirilis. Berikut 5 berita terpopuler pilihan redaksi detikHOT: 1. 8 Hari Nikah, Bella Luna dan Suami Dilaporkan Polisi googletag.cmd.push(function() { googletag.display(\'div-gpt-ad-1535944650921-0\'); }); Shirley menepati janjinya untuk melaporkan Bella Luna dan suaminya, Nana. Hari ini wanita yang mengaku masih istri sah Nana itu membuat laporan di Polda Metro Jaya.Bella Luna Ferlin dan Nana yang baru menikah delapan hari dilaporkan Shirley atas dugaan kasus menghilangkan asal usul perkawinan. Mereka disebut melanggar Pasal 279 dan 280 KUHP.""Pertama alhamdulillah, laporan kami diterima setelah didiskusikan dengan pihak penyidik. Akhirnya kita memutuskan perkara ini terkait dengan menghilangkan asal usul perkawinan. Pasal 279 dan 280 KUHP pidana ancaman hukuman tujuh tahun,"" ujar pengacara Shirley, Razman Arif Nasution di Polda Metro Jaya, Sabtu (23/2/2019).2. Jerinx \'SID\' Disumpahi Kena Karma oleh AshantyPerseteruan Jerinx \'SID\' dan Keluarga Anang Hermansyah masih berlanjut. Bahkan Jerinx mengunggah sebuah tangkapan layar percakapan di Instagramnya yang bernada dirinya disumpah oleh Ashanty agar terkena karma.Lantaran itu Jerink pun marah dan menyebut Ashanty sebagai orang yang busuk. Dilihat dari screenshot yang tersebar di media sosial, ada percakapan antara Ashanty dan pemilik Sanur Garage melalui pesan WhatsApp.Sanur Garage diketahui adalah tempat Anang dan Jerinx melakukan pertemuan beberapa waktu lalu. 3. Mewah! Panggung Oscar 2019 Bertabur 41 Ribu SwarovskiOscar lekat dengan image glamor dalam setiap penyelenggaraannya. Seperti tahun-tahun sebelumnya, ajang ini kembali menerapkan desain panggung dengan sentuhan berlian Swarovski.Dikutip Architectural Digest, ada 41 ribu Swarovski yang digunakan untuk mempercantik panggung Oscar.Akademi menggandeng perancang panggung David Korins yang didapuk merancang empat panggung berbeda dengan sentuhan Swarovski untuk malam penghargaan. Panggung-panggung itu dibuat dengan tema yang berbeda.4. Syahrini akan Nikah dengan Reino Barack, Nikita Mirzani: Benar Kan Mulut Gue! Syahrini dikabarkan akan menikah dengan Reino Barack tak lama lagi di Jepang. Nikita Mirzani yang mendengar kabar itu pun langsung mengucapkan selamat.Nikita mengatakan kalau tebakannya beberapa waktu lalu soal Syahrini dan Reino Barack di sebuah acara benar terjadi. Artis seksi itu mengaku sudah menebak mereka akan menikah sebelum adanya peramal.""Oh iya congratulation ya akhirnya benar kan mulut gue. Awalnya semuanya kan dari gue, habis itu para dukun abal-abal itu pada sok tahu, benar nggak? Ya kan awalnya kan gue pencetusnya,"" ujarnya di kawasan Jagakarsa, Jakarta Selatan, Sabtu (23/2/2019).5. Trailer \'My Stupid Boss 2\' Resmi Rilis, Kocak dan Penuh KeteganganReza Rahadian dan Bunga Citra Lestari kembali duet dalam film \'My Stupid Boss 2\'. Falcon Pictures kini merilis poster dan trailer resmi film yang diangkat dari novel karya chaos@work.\'My Stupid Boss 2\' kembali menceritakan kisah konyol tentang sosok Bossman (Reza Rahadian), Kerani (Bunga Citra Lestari), dan kehidupan karyawan di kantor tersebut. Dalam trailer berdurasi 2 menit 19 detik, menampilkan karyawan di pabrik Bossman yang mengundurkan diri. (tia/tia) multipel seleb bella luna my stupid boss 2 syahrini syahrini akan menikah isu reino barack dan syahrini <!--// <![CDATA[ OA_show(\'newstag\'); // ]]> --> Photo Gallery 1 celeb Resmi Menikah, Ini Transformasi Penampilan Syahrini celeb Resmi Menikah, Ini Transformasi Penampilan Syahrini celeb Resmi Menikah, Ini Transformasi Penampilan Syahrini celeb Resmi Menikah, Ini Transformasi Penampilan Syahrini celeb Resmi Menikah, Ini Transformasi Penampilan Syahrini celeb Resmi Menikah, Ini Transformasi Penampilan Syahrini celeb Resmi Menikah, Ini Transformasi Penampilan Syahrini celeb Resmi Menikah, Ini Transformasi Penampilan Syahrini celeb Resmi Menikah, Ini Transformasi Penampilan Syahrini celeb Resmi Menikah, Ini Transformasi Penampilan Syahrini celeb Resmi Menikah, Ini Transformasi Penampilan Syahrini celeb Resmi Menikah, Ini Transformasi Penampilan Syahrini 1 celeb Si Seksi Dua Lipa, Krisdayanti hingga Persiapan Jelang Oscar 2019 celeb Si Seksi Dua Lipa, Krisdayanti hingga Persiapan Jelang Oscar 2019 celeb Si Seksi Dua Lipa, Krisdayanti hingga Persiapan Jelang Oscar 2019 celeb Si Seksi Dua Lipa, Krisdayanti hingga Persiapan Jelang Oscar 2019 celeb Si Seksi Dua Lipa, Krisdayanti hingga Persiapan Jelang Oscar 2019 celeb Si Seksi Dua Lipa, Krisdayanti hingga Persiapan Jelang Oscar 2019 celeb Si Seksi Dua Lipa, Krisdayanti hingga Persiapan Jelang Oscar 2019 celeb Si Seksi Dua Lipa, Krisdayanti hingga Persiapan Jelang Oscar 2019 celeb Si Seksi Dua Lipa, Krisdayanti hingga Persiapan Jelang Oscar 2019 celeb Si Seksi Dua Lipa, Krisdayanti hingga Persiapan Jelang Oscar 2019 2 celeb Dear Bella Luna, Lihat Bukti-bukti Istri Sah Nana! celeb Dear Bella Luna, Lihat Bukti-bukti Istri Sah Nana! celeb Dear Bella Luna, Lihat Bukti-bukti Istri Sah Nana! celeb Dear Bella Luna, Lihat Bukti-bukti Istri Sah Nana! celeb Dear Bella Luna, Lihat Bukti-bukti Istri Sah Nana! celeb Dear Bella Luna, Lihat Bukti-bukti Istri Sah Nana! 3 celeb Pesona Luna Maya dengan Dress Floral celeb Pesona Luna Maya dengan Dress Floral celeb Pesona Luna Maya dengan Dress Floral celeb Pesona Luna Maya dengan Dress Floral celeb Pesona Luna Maya dengan Dress Floral celeb Pesona Luna Maya dengan Dress Floral celeb Pesona Luna Maya dengan Dress Floral celeb Pesona Luna Maya dengan Dress Floral 4 celeb Momen Bahagia Pernikahan Bella Luna celeb Momen Bahagia Pernikahan Bella Luna celeb Momen Bahagia Pernikahan Bella Luna celeb Momen Bahagia Pernikahan Bella Luna celeb Momen Bahagia Pernikahan Bella Luna celeb Momen Bahagia Pernikahan Bella Luna 5 celeb Tampilan Baru Jeremy Teti hingga si Seksi Bella Luna celeb Tampilan Baru Jeremy Teti hingga si Seksi Bella Luna celeb Tampilan Baru Jeremy Teti hingga si Seksi Bella Luna celeb Tampilan Baru Jeremy Teti hingga si Seksi Bella Luna celeb Tampilan Baru Jeremy Teti hingga si Seksi Bella Luna celeb Tampilan Baru Jeremy Teti hingga si Seksi Bella Luna 6 celeb Menikah Ketiga Kalinya, Bella Luna Makin Rajin Perawatan celeb Menikah Ketiga Kalinya, Bella Luna Makin Rajin Perawatan celeb Menikah Ketiga Kalinya, Bella Luna Makin Rajin Perawatan celeb Menikah Ketiga Kalinya, Bella Luna Makin Rajin Perawatan celeb Menikah Ketiga Kalinya, Bella Luna Makin Rajin Perawatan celeb Menikah Ketiga Kalinya, Bella Luna Makin Rajin Perawatan 7 celeb Ahmad Dhani Divonis Penjara, James Ingram, Saphira Indah hingga Bella Luna celeb Ahmad Dhani Divonis Penjara, James Ingram, Saphira Indah hingga Bella Luna celeb Ahmad Dhani Divonis Penjara, James Ingram, Saphira Indah hingga Bella Luna celeb Ahmad Dhani Divonis Penjara, James Ingram, Saphira Indah hingga Bella Luna celeb Ahmad Dhani Divonis Penjara, James Ingram, Saphira Indah hingga Bella Luna celeb Ahmad Dhani Divonis Penjara, James Ingram, Saphira Indah hingga Bella Luna celeb Ahmad Dhani Divonis Penjara, James Ingram, Saphira Indah hingga Bella Luna celeb Ahmad Dhani Divonis Penjara, James Ingram, Saphira Indah hingga Bella Luna celeb Ahmad Dhani Divonis Penjara, James Ingram, Saphira Indah hingga Bella Luna celeb Ahmad Dhani Divonis Penjara, James Ingram, Saphira Indah hingga Bella Luna celeb Ahmad Dhani Divonis Penjara, James Ingram, Saphira Indah hingga Bella Luna celeb Ahmad Dhani Divonis Penjara, James Ingram, Saphira Indah hingga Bella Luna celeb Ahmad Dhani Divonis Penjara, James Ingram, Saphira Indah hingga Bella Luna 8 celeb Bella Luna Pajang Foto Naik Kuda, Netizen: Besok Aku Prewed Pake Onta celeb Bella Luna Pajang Foto Naik Kuda, Netizen: Besok Aku Prewed Pake Onta celeb Bella Luna Pajang Foto Naik Kuda, Netizen: Besok Aku Prewed Pake Onta celeb Bella Luna Pajang Foto Naik Kuda, Netizen: Besok Aku Prewed Pake Onta celeb Bella Luna Pajang Foto Naik Kuda, Netizen: Besok Aku Prewed Pake Onta celeb Bella Luna Pajang Foto Naik Kuda, Netizen: Besok Aku Prewed Pake Onta celeb Bella Luna Pajang Foto Naik Kuda, Netizen: Besok Aku Prewed Pake Onta 9 celeb Steve Emmanuel, Wonder Woman hingga Hailee Steinfeld celeb Steve Emmanuel, Wonder Woman hingga Hailee Steinfeld celeb Steve Emmanuel, Wonder Woman hingga Hailee Steinfeld celeb Steve Emmanuel, Wonder Woman hingga Hailee Steinfeld celeb Steve Emmanuel, Wonder Woman hingga Hailee Steinfeld celeb Steve Emmanuel, Wonder Woman hingga Hailee Steinfeld celeb Steve Emmanuel, Wonder Woman hingga Hailee Steinfeld celeb Steve Emmanuel, Wonder Woman hingga Hailee Steinfeld 10 on-stage Saat Syahrini Jauh dari Glamor dan Kemewahan on-stage Saat Syahrini Jauh dari Glamor dan Kemewahan on-stage Saat Syahrini Jauh dari Glamor dan Kemewahan on-stage Saat Syahrini Jauh dari Glamor dan Kemewahan on-stage Saat Syahrini Jauh dari Glamor dan Kemewahan on-stage Saat Syahrini Jauh dari Glamor dan Kemewahan on-stage Saat Syahrini Jauh dari Glamor dan Kemewahan 11 celeb Cetar! Gaya Syahrini Anggun Banget celeb Cetar! Gaya Syahrini Anggun Banget celeb Cetar! Gaya Syahrini Anggun Banget celeb Cetar! Gaya Syahrini Anggun Banget celeb Cetar! Gaya Syahrini Anggun Banget celeb Cetar! Gaya Syahrini Anggun Banget 12 celeb Gaya Dewi Perssik di Polda, Tiru Syahrini? celeb Gaya Dewi Perssik di Polda, Tiru Syahrini? celeb Gaya Dewi Perssik di Polda, Tiru Syahrini? celeb Gaya Dewi Perssik di Polda, Tiru Syahrini? celeb Gaya Dewi Perssik di Polda, Tiru Syahrini? celeb Gaya Dewi Perssik di Polda, Tiru Syahrini? celeb Gaya Dewi Perssik di Polda, Tiru Syahrini? 13 celeb Kakak Syahrini Meninggal, Ini Kenangannya Bersama Keluarga celeb Kakak Syahrini Meninggal, Ini Kenangannya Bersama Keluarga celeb Kakak Syahrini Meninggal, Ini Kenangannya Bersama Keluarga celeb Kakak Syahrini Meninggal, Ini Kenangannya Bersama Keluarga celeb Kakak Syahrini Meninggal, Ini Kenangannya Bersama Keluarga celeb Kakak Syahrini Meninggal, Ini Kenangannya Bersama Keluarga celeb Kakak Syahrini Meninggal, Ini Kenangannya Bersama Keluarga celeb Kakak Syahrini Meninggal, Ini Kenangannya Bersama Keluarga 14 celeb Syahrini Gelar Konser Tunggal, Dede \'Idol\' Ditangkap Polisi celeb Syahrini Gelar Konser Tunggal, Dede \'Idol\' Ditangkap Polisi celeb Syahrini Gelar Konser Tunggal, Dede \'Idol\' Ditangkap Polisi celeb Syahrini Gelar Konser Tunggal, Dede \'Idol\' Ditangkap Polisi celeb Syahrini Gelar Konser Tunggal, Dede \'Idol\' Ditangkap Polisi celeb Syahrini Gelar Konser Tunggal, Dede \'Idol\' Ditangkap Polisi celeb Syahrini Gelar Konser Tunggal, Dede \'Idol\' Ditangkap Polisi celeb Syahrini Gelar Konser Tunggal, Dede \'Idol\' Ditangkap Polisi celeb Syahrini Gelar Konser Tunggal, Dede \'Idol\' Ditangkap Polisi 15 on-stage Syahrini Berkilauan di Konser Tunggal on-stage Syahrini Berkilauan di Konser Tunggal on-stage Syahrini Berkilauan di Konser Tunggal on-stage Syahrini Berkilauan di Konser Tunggal on-stage Syahrini Berkilauan di Konser Tunggal on-stage Syahrini Berkilauan di Konser Tunggal 16 on-stage Cetar! Penampilan Syahrini dengan Jambul Super Tinggi on-stage Cetar! Penampilan Syahrini dengan Jambul Super Tinggi on-stage Cetar! Penampilan Syahrini dengan Jambul Super Tinggi on-stage Cetar! Penampilan Syahrini dengan Jambul Super Tinggi on-stage Cetar! Penampilan Syahrini dengan Jambul Super Tinggi on-stage Cetar! Penampilan Syahrini dengan Jambul Super Tinggi on-stage Cetar! Penampilan Syahrini dengan Jambul Super Tinggi 17 on-stage Seperti Apa Latihan Syahrini Jelang Konser? on-stage Seperti Apa Latihan Syahrini Jelang Konser? on-stage Seperti Apa Latihan Syahrini Jelang Konser? on-stage Seperti Apa Latihan Syahrini Jelang Konser? on-stage Seperti Apa Latihan Syahrini Jelang Konser? on-stage Seperti Apa Latihan Syahrini Jelang Konser? on-stage Seperti Apa Latihan Syahrini Jelang Konser? on-stage Seperti Apa Latihan Syahrini Jelang Konser? 18 celeb Persiapan Syahrini, Stand Up Comedy hingga Headpiece celeb Persiapan Syahrini, Stand Up Comedy hingga Headpiece celeb Persiapan Syahrini, Stand Up Comedy hingga Headpiece celeb Persiapan Syahrini, Stand Up Comedy hingga Headpiece celeb Persiapan Syahrini, Stand Up Comedy hingga Headpiece celeb Persiapan Syahrini, Stand Up Comedy hingga Headpiece 19 celeb Dear Syahrini, Ayu Ting Ting Nonton dan Foto Bareng Tim Voli Lho! celeb Dear Syahrini, Ayu Ting Ting Nonton dan Foto Bareng Tim Voli Lho! celeb Dear Syahrini, Ayu Ting Ting Nonton dan Foto Bareng Tim Voli Lho! celeb Dear Syahrini, Ayu Ting Ting Nonton dan Foto Bareng Tim Voli Lho! celeb Dear Syahrini, Ayu Ting Ting Nonton dan Foto Bareng Tim Voli Lho! celeb Dear Syahrini, Ayu Ting Ting Nonton dan Foto Bareng Tim Voli Lho! celeb Dear Syahrini, Ayu Ting Ting Nonton dan Foto Bareng Tim Voli Lho! 20 1 <!--// <![CDATA[ OA_show(\'hiddenquiz\'); // ]]> -->']"
